dev-mfma-tn/3_LibraryLogic/arcturus_Cijk_Alik_Bljk_BBH.yaml
- {MinimumRequiredVersion: 4.15.0}
- arcturus
- gfx908
- [Device 7380, Device 7388, Device 738c, Device 7390]
    SolutionIndex: 0
    SolutionNameMin: Cijk_Alik_Bljk_BBH_MT64x128x16_MI32x32x2x2_SE_AF0EM1_AF1EM2_ASEM1_GRVW2_ONLL0_SNLL1
    SolutionIndex: 1
    SolutionNameMin: Cijk_Alik_Bljk_BBH_MT64x128x16_MI32x32x2x2_SE_AF0EM1_AF1EM1_ASEM2_GRVW4_ONLL0_SNLL1
    SolutionIndex: 2
    SolutionNameMin: Cijk_Alik_Bljk_BBH_MT64x128x16_MI32x32x2x2_SE_AF0EM2_AF1EM1_ASEM1_GRVW4_ONLL0_SNLL1
    SolutionIndex: 3
    SolutionNameMin: Cijk_Alik_Bljk_BBH_MT64x128x16_MI32x32x2x2_SE_AF0EM1_AF1EM2_ASEM2_GRVW4_ONLL0_SNLL1
    SolutionIndex: 4
    SolutionNameMin: Cijk_Alik_Bljk_BBH_MT64x128x16_MI32x32x2x2_SE_AF0EM2_AF1EM2_ASEM2_GRVW4_ONLL0_SNLL1
    SolutionIndex: 5
    SolutionNameMin: Cijk_Alik_Bljk_BBH_MT64x128x32_MI32x32x2x2_SE_AF0EM2_AF1EM2_ASEM2_GRVW4_ONLL0_SNLL1
    SolutionIndex: 6
    SolutionNameMin: Cijk_Alik_Bljk_BBH_MT64x128x8_MI32x32x2x2_SE_AF0EM1_AF1EM1_ASEM1_GRVW4_ONLL0_SNLL0
    SolutionIndex: 7
    SolutionNameMin: Cijk_Alik_Bljk_BBH_MT32x256x16_MI32x32x2x2_SE_AF0EM2_AF1EM1_ASEM1_GRVW4_ONLL0_SNLL0
    SolutionIndex: 8
    SolutionNameMin: Cijk_Alik_Bljk_BBH_MT64x128x16_MI32x32x2x2_SE_AF0EM1_AF1EM1_ASEM1_GRVW4_ONLL0_SNLL0
    SolutionIndex: 9
    SolutionNameMin: Cijk_Alik_Bljk_BBH_MT64x128x16_MI32x32x2x2_SE_AF0EM1_AF1EM1_ASEM2_GRVW4_ONLL0_SNLL0
    SolutionIndex: 10
    SolutionNameMin: Cijk_Alik_Bljk_BBH_MT64x128x16_MI32x32x2x2_SE_AF0EM2_AF1EM1_ASEM1_GRVW4_ONLL0_SNLL0
    SolutionIndex: 11
    SolutionNameMin: Cijk_Alik_Bljk_BBH_MT64x128x16_MI32x32x2x2_SE_AF0EM2_AF1EM1_ASEM2_GRVW4_ONLL0_SNLL0
    SolutionIndex: 12
    SolutionNameMin: Cijk_Alik_Bljk_BBH_MT64x128x16_MI32x32x2x2_SE_AF0EM1_AF1EM2_ASEM1_GRVW4_ONLL0_SNLL0
    SolutionIndex: 13
    SolutionNameMin: Cijk_Alik_Bljk_BBH_MT64x128x16_MI32x32x2x2_SE_AF0EM1_AF1EM2_ASEM2_GRVW4_ONLL0_SNLL0
    SolutionIndex: 14
    SolutionNameMin: Cijk_Alik_Bljk_BBH_MT64x128x16_MI32x32x2x2_SE_AF0EM2_AF1EM2_ASEM1_GRVW4_ONLL0_SNLL0
    SolutionIndex: 15
    SolutionNameMin: Cijk_Alik_Bljk_BBH_MT64x128x16_MI32x32x2x2_SE_AF0EM2_AF1EM2_ASEM2_GRVW4_ONLL0_SNLL0
    SolutionIndex: 16
    SolutionNameMin: Cijk_Alik_Bljk_BBH_MT64x128x32_MI32x32x2x2_SE_AF0EM1_AF1EM1_ASEM1_GRVW4_ONLL0_SNLL0
    SolutionIndex: 17
    SolutionNameMin: Cijk_Alik_Bljk_BBH_MT64x128x32_MI32x32x2x2_SE_AF0EM1_AF1EM1_ASEM2_GRVW4_ONLL0_SNLL0
    SolutionIndex: 18
    SolutionNameMin: Cijk_Alik_Bljk_BBH_MT64x128x32_MI32x32x2x2_SE_AF0EM2_AF1EM1_ASEM1_GRVW4_ONLL0_SNLL0
    SolutionIndex: 19
    SolutionNameMin: Cijk_Alik_Bljk_BBH_MT64x128x32_MI32x32x2x2_SE_AF0EM1_AF1EM2_ASEM1_GRVW4_ONLL0_SNLL0
    SolutionIndex: 20
    SolutionNameMin: Cijk_Alik_Bljk_BBH_MT64x128x32_MI32x32x2x2_SE_AF0EM1_AF1EM2_ASEM2_GRVW4_ONLL0_SNLL0
    SolutionIndex: 21
    SolutionNameMin: Cijk_Alik_Bljk_BBH_MT64x128x32_MI32x32x2x2_SE_AF0EM2_AF1EM2_ASEM1_GRVW4_ONLL0_SNLL0
    SolutionIndex: 22
    SolutionNameMin: Cijk_Alik_Bljk_BBH_MT64x128x32_MI32x32x2x2_SE_AF0EM2_AF1EM2_ASEM2_GRVW4_ONLL0_SNLL0
    SolutionIndex: 23
    SolutionNameMin: Cijk_Alik_Bljk_BBH_MT64x128x16_MI32x32x2x2_SE_AF0EM1_AF1EM1_ASEM2_GRVW4_ONLL1_SNLL1
    SolutionIndex: 24
    SolutionNameMin: Cijk_Alik_Bljk_BBH_MT64x128x16_MI32x32x2x2_SE_AF0EM2_AF1EM1_ASEM1_GRVW4_ONLL1_SNLL1
    SolutionIndex: 25
    SolutionNameMin: Cijk_Alik_Bljk_BBH_MT64x128x16_MI32x32x2x2_SE_AF0EM2_AF1EM1_ASEM2_GRVW4_ONLL1_SNLL1
    SolutionIndex: 26
    SolutionNameMin: Cijk_Alik_Bljk_BBH_MT64x128x16_MI32x32x2x2_SE_AF0EM1_AF1EM2_ASEM2_GRVW4_ONLL1_SNLL1
    SolutionIndex: 27
    SolutionNameMin: Cijk_Alik_Bljk_BBH_MT64x128x8_MI32x32x2x2_SE_AF0EM1_AF1EM1_ASEM2_GRVW4_ONLL1_SNLL0
    SolutionIndex: 28
    SolutionNameMin: Cijk_Alik_Bljk_BBH_MT64x128x16_MI32x32x2x2_SE_AF0EM1_AF1EM1_ASEM1_GRVW4_ONLL1_SNLL0
    SolutionIndex: 29
    SolutionNameMin: Cijk_Alik_Bljk_BBH_MT64x128x16_MI32x32x2x2_SE_AF0EM1_AF1EM1_ASEM2_GRVW4_ONLL1_SNLL0
    SolutionIndex: 30
    SolutionNameMin: Cijk_Alik_Bljk_BBH_MT64x128x16_MI32x32x2x2_SE_AF0EM2_AF1EM1_ASEM1_GRVW4_ONLL1_SNLL0
    SolutionIndex: 31
    SolutionNameMin: Cijk_Alik_Bljk_BBH_MT64x128x16_MI32x32x2x2_SE_AF0EM2_AF1EM1_ASEM2_GRVW4_ONLL1_SNLL0
    SolutionIndex: 32
    SolutionNameMin: Cijk_Alik_Bljk_BBH_MT64x128x16_MI32x32x2x2_SE_AF0EM1_AF1EM2_ASEM1_GRVW4_ONLL1_SNLL0
    SolutionIndex: 33
    SolutionNameMin: Cijk_Alik_Bljk_BBH_MT64x128x16_MI32x32x2x2_SE_AF0EM1_AF1EM2_ASEM2_GRVW4_ONLL1_SNLL0
    SolutionIndex: 34
    SolutionNameMin: Cijk_Alik_Bljk_BBH_MT64x128x16_MI32x32x2x2_SE_AF0EM2_AF1EM2_ASEM1_GRVW4_ONLL1_SNLL0
    SolutionIndex: 35
    SolutionNameMin: Cijk_Alik_Bljk_BBH_MT64x128x16_MI32x32x2x2_SE_AF0EM2_AF1EM2_ASEM2_GRVW4_ONLL1_SNLL0
    SolutionIndex: 36
    SolutionNameMin: Cijk_Alik_Bljk_BBH_MT64x128x32_MI32x32x2x2_SE_AF0EM1_AF1EM1_ASEM1_GRVW4_ONLL1_SNLL0
    SolutionIndex: 37
    SolutionNameMin: Cijk_Alik_Bljk_BBH_MT64x128x32_MI32x32x2x2_SE_AF0EM2_AF1EM1_ASEM1_GRVW4_ONLL1_SNLL0
    SolutionIndex: 38
    SolutionNameMin: Cijk_Alik_Bljk_BBH_MT64x128x32_MI32x32x2x2_SE_AF0EM1_AF1EM2_ASEM1_GRVW4_ONLL1_SNLL0
    SolutionIndex: 39
    SolutionNameMin: Cijk_Alik_Bljk_BBH_MT64x128x32_MI32x32x2x2_SE_AF0EM2_AF1EM2_ASEM1_GRVW4_ONLL1_SNLL0
    SolutionIndex: 40
    SolutionNameMin: Cijk_Alik_Bljk_BBH_MT64x256x16_MI32x32x2x2_SE_AF0EM1_AF1EM1_ASEM1_GRVW4_ONLL1_SNLL0
- - - [256, 1280, 1, 1024, 256, 256, 1024, 1024]
    - [29, 3603.35]
  - - [256, 44505, 1, 1024, 256, 256, 1024, 1024]
    - [1, 16276.1]
  - - [10240, 8976, 1, 256, 10240, 10240, 256, 256]
    - [14, 14552.8]
  - - [1024, 1600, 1, 1024, 1024, 1024, 1024, 1024]
    - [35, 15163.8]
  - - [256, 7168, 1, 1024, 256, 256, 1024, 1024]
    - [37, 13898.3]
  - - [1024, 1600, 1, 560, 1024, 1024, 560, 560]
    - [11, 13685.9]
  - - [18944, 8976, 1, 256, 18944, 18944, 256, 256]
    - [10, 17805.4]
  - - [256, 19200, 1, 1024, 256, 256, 1024, 1024]
    - [17, 13012.3]
  - - [5632, 8976, 1, 256, 5632, 5632, 256, 256]
    - [8, 17405.8]
  - - [256, 23552, 1, 1024, 256, 256, 1024, 1024]
    - [39, 12862.5]
  - - [256, 14848, 1, 1024, 256, 256, 1024, 1024]
    - [21, 14562.7]
  - - [9984, 8976, 1, 256, 9984, 9984, 256, 256]
    - [15, 17695.5]
  - - [8448, 8976, 1, 256, 8448, 8448, 256, 256]
    - [30, 17636.0]
  - - [256, 14336, 1, 1024, 256, 256, 1024, 1024]
    - [18, 14128.2]
  - - [2048, 215, 1, 512, 2048, 2048, 512, 512]
    - [10, 3980.29]
  - - [256, 12544, 1, 1024, 256, 256, 1024, 1024]
    - [40, 12745.5]
  - - [11264, 8976, 1, 256, 11264, 11264, 256, 256]
    - [15, 16915.3]
  - - [512, 1600, 1, 512, 512, 512, 512, 512]
    - [30, 7955.81]
  - - [32, 1600, 1, 512, 32, 32, 512, 512]
    - [30, 538.062]
  - - [9472, 8976, 1, 256, 9472, 9472, 256, 256]
    - [31, 17664.4]
  - - [5376, 8976, 1, 256, 5376, 5376, 256, 256]
    - [13, 17371.6]
  - - [256, 5888, 1, 1024, 256, 256, 1024, 1024]
    - [3, 11636.8]
  - - [19968, 8976, 1, 256, 19968, 19968, 256, 256]
    - [11, 17820.8]
  - - [3840, 8976, 1, 256, 3840, 3840, 256, 256]
    - [11, 17166.9]
  - - [4608, 8976, 1, 256, 4608, 4608, 256, 256]
    - [10, 17267.7]
  - - [256, 684, 1, 1024, 256, 256, 1024, 1024]
    - [15, 2021.04]
  - - [256, 22016, 1, 1024, 256, 256, 1024, 1024]
    - [22, 14577.1]
  - - [2048, 256, 1, 512, 2048, 2048, 512, 512]
    - [28, 5146.39]
  - - [4864, 8976, 1, 256, 4864, 4864, 256, 256]
    - [10, 17323.0]
  - - [256, 7424, 1, 1024, 256, 256, 1024, 1024]
    - [38, 14352.2]
  - - [18176, 8976, 1, 256, 18176, 18176, 256, 256]
    - [35, 17803.6]
  - - [256, 15104, 1, 1024, 256, 256, 1024, 1024]
    - [39, 14752.0]
  - - [19712, 8976, 1, 256, 19712, 19712, 256, 256]
    - [31, 17800.9]
  - - [8192, 8976, 1, 256, 8192, 8192, 256, 256]
    - [25, 11250.3]
  - - [256, 16128, 1, 1024, 256, 256, 1024, 1024]
    - [36, 11997.3]
  - - [256, 6656, 1, 1024, 256, 256, 1024, 1024]
    - [36, 12837.2]
  - - [256, 21504, 1, 1024, 256, 256, 1024, 1024]
    - [36, 14243.9]
  - - [2048, 512, 1, 100, 2048, 2048, 100, 100]
    - [9, 3581.2]
  - - [9, 9, 512, 64, 9, 9, 64, 64]
    - [27, 80.7241]
  - - [6400, 8976, 1, 256, 6400, 6400, 256, 256]
    - [11, 17502.5]
  - - [256, 31488, 1, 1024, 256, 256, 1024, 1024]
    - [19, 13581.7]
  - - [256, 8960, 1, 1024, 256, 256, 1024, 1024]
    - [28, 11070.9]
  - - [13824, 8976, 1, 256, 13824, 13824, 256, 256]
    - [15, 17739.0]
  - - [11776, 8976, 1, 256, 11776, 11776, 256, 256]
    - [15, 17702.7]
  - - [256, 20992, 1, 1024, 256, 256, 1024, 1024]
    - [19, 14026.6]
  - - [20480, 8976, 1, 256, 20480, 20480, 256, 256]
    - [28, 11906.5]
  - - [33, 33, 1600, 32, 33, 33, 32, 32]
    - [8, 735.19]
  - - [2048, 684, 1, 768, 2048, 2048, 768, 768]
    - [15, 12428.8]
  - - [1024, 200, 1, 560, 1024, 1024, 560, 560]
    - [14, 2056.81]
  - - [2048, 512, 1, 2048, 2048, 2048, 2048, 2048]
    - [9, 10328.4]
  - - [21248, 8976, 1, 256, 21248, 21248, 256, 256]
    - [31, 17828.7]
  - - [5120, 8976, 1, 256, 5120, 5120, 256, 256]
    - [35, 16677.6]
  - - [7168, 8976, 1, 256, 7168, 7168, 256, 256]
    - [29, 16786.6]
  - - [256, 8192, 1, 1024, 256, 256, 1024, 1024]
    - [1, 11957.0]
  - - [4096, 8976, 1, 256, 4096, 4096, 256, 256]
    - [32, 11110.6]
  - - [3328, 8976, 1, 256, 3328, 3328, 256, 256]
    - [29, 16969.8]
  - - [17152, 8976, 1, 256, 17152, 17152, 256, 256]
    - [11, 17820.3]
  - - [28672, 8976, 1, 256, 28672, 28672, 256, 256]
    - [8, 12035.1]
  - - [2560, 8976, 1, 256, 2560, 2560, 256, 256]
    - [31, 16841.8]
  - - [3072, 8976, 1, 256, 3072, 3072, 256, 256]
    - [15, 16410.2]
  - - [256, 3584, 1, 1024, 256, 256, 1024, 1024]
    - [15, 9532.51]
  - - [18688, 8976, 1, 256, 18688, 18688, 256, 256]
    - [11, 17827.9]
  - - [15104, 8976, 1, 256, 15104, 15104, 256, 256]
    - [35, 17815.2]
  - - [23552, 8976, 1, 256, 23552, 23552, 256, 256]
    - [11, 16995.1]
  - - [6144, 8976, 1, 256, 6144, 6144, 256, 256]
    - [10, 14464.0]
  - - [64, 512, 1, 1024, 64, 64, 1024, 1024]
    - [15, 375.834]
  - - [12544, 8976, 1, 256, 12544, 12544, 256, 256]
    - [30, 17736.8]
  - - [256, 11264, 1, 1024, 256, 256, 1024, 1024]
    - [0, 12627.4]
  - - [2304, 8976, 1, 256, 2304, 2304, 256, 256]
    - [11, 16699.1]
  - - [4352, 8976, 1, 256, 4352, 4352, 256, 256]
    - [32, 17258.5]
  - - [5888, 8976, 1, 256, 5888, 5888, 256, 256]
    - [33, 17442.5]
  - - [256, 23296, 1, 1024, 256, 256, 1024, 1024]
    - [4, 12825.3]
  - - [16128, 8976, 1, 256, 16128, 16128, 256, 256]
    - [15, 17838.5]
  - - [5, 5, 512, 64, 5, 5, 64, 64]
    - [6, 24.9148]
  - - [256, 18176, 1, 1024, 256, 256, 1024, 1024]
    - [5, 13061.2]
  - - [9728, 8976, 1, 256, 9728, 9728, 256, 256]
    - [11, 17641.2]
  - - [256, 2816, 1, 1024, 256, 256, 1024, 1024]
    - [34, 7793.47]
  - - [256, 18944, 1, 1024, 256, 256, 1024, 1024]
    - [16, 12865.4]
  - - [7936, 8976, 1, 256, 7936, 7936, 256, 256]
    - [29, 17625.3]
  - - [256, 14592, 1, 1024, 256, 256, 1024, 1024]
    - [17, 14337.4]
  - - [256, 8448, 1, 1024, 256, 256, 1024, 1024]
    - [11, 11234.7]
  - - [1024, 512, 1, 1024, 1024, 1024, 1024, 1024]
    - [10, 5986.52]
  - - [256, 11776, 1, 1024, 256, 256, 1024, 1024]
    - [40, 12427.6]
  - - [256, 6144, 1, 1024, 256, 256, 1024, 1024]
    - [24, 12077.2]
  - - [1280, 8976, 1, 256, 1280, 1280, 256, 256]
    - [10, 16040.9]
  - - [256, 22344, 1, 1024, 256, 256, 1024, 1024]
    - [39, 14734.7]
  - - [2048, 215, 1, 768, 2048, 2048, 768, 768]
    - [10, 4435.54]
  - - [256, 9984, 1, 1024, 256, 256, 1024, 1024]
    - [8, 11519.6]
  - - [684, 8976, 1, 256, 684, 684, 256, 256]
    - [30, 14951.8]
  - - [20992, 8976, 1, 256, 20992, 20992, 256, 256]
    - [30, 17819.0]
  - - [13568, 8976, 1, 256, 13568, 13568, 256, 256]
    - [14, 17751.5]
  - - [256, 1536, 1, 1024, 256, 256, 1024, 1024]
    - [31, 4294.51]
  - - [2048, 684, 1, 512, 2048, 2048, 512, 512]
    - [14, 11123.2]
  - - [8960, 8976, 1, 256, 8960, 8960, 256, 256]
    - [15, 17654.0]
  - - [2048, 1536, 1, 512, 2048, 2048, 512, 512]
    - [28, 14990.8]
  - - [256, 3328, 1, 1024, 256, 256, 1024, 1024]
    - [32, 9042.45]
  - - [33536, 8976, 1, 256, 33536, 33536, 256, 256]
    - [10, 17919.8]
  - - [2048, 8976, 1, 256, 2048, 2048, 256, 256]
    - [30, 14453.4]
  - - [256, 5376, 1, 1024, 256, 256, 1024, 1024]
    - [1, 11838.8]
  - - [2048, 1536, 1, 768, 2048, 2048, 768, 768]
    - [15, 16814.6]
  - - [256, 13312, 1, 1024, 256, 256, 1024, 1024]
    - [39, 13242.5]
  - - [15360, 8976, 1, 256, 15360, 15360, 256, 256]
    - [15, 16942.1]
  - - [2048, 512, 1, 67, 2048, 2048, 67, 67]
    - [8, 2453.02]
  - - [256, 10496, 1, 1024, 256, 256, 1024, 1024]
    - [2, 12376.1]
  - - [256, 4864, 1, 1024, 256, 256, 1024, 1024]
    - [8, 11083.7]
  - - [10496, 8976, 1, 256, 10496, 10496, 256, 256]
    - [30, 17700.7]
  - - [15872, 8976, 1, 256, 15872, 15872, 256, 256]
    - [30, 17816.8]
  - - [13312, 8976, 1, 256, 13312, 13312, 256, 256]
    - [31, 16923.2]
  - - [1792, 8976, 1, 256, 1792, 1792, 256, 256]
    - [31, 16371.5]
  - - [1024, 512, 1, 1600, 1024, 1024, 1600, 1600]
    - [30, 6401.56]
  - - [256, 6400, 1, 1024, 256, 256, 1024, 1024]
    - [19, 12460.8]
  - - [256, 33536, 1, 1024, 256, 256, 1024, 1024]
    - [20, 14327.4]
  - - [256, 21248, 1, 1024, 256, 256, 1024, 1024]
    - [19, 14174.6]
  - - [31488, 8976, 1, 256, 31488, 31488, 256, 256]
    - [15, 17908.9]
  - - [256, 20480, 1, 1024, 256, 256, 1024, 1024]
    - [38, 13698.5]
  - - [44505, 8976, 1, 256, 44505, 44505, 256, 256]
    - [26, 16368.9]
  - - [2048, 114, 1, 768, 2048, 2048, 768, 768]
    - [15, 2201.7]
  - - [256, 11520, 1, 1024, 256, 256, 1024, 1024]
    - [4, 12714.3]
  - - [256, 7936, 1, 1024, 256, 256, 1024, 1024]
    - [29, 12123.4]
  - - [2048, 114, 1, 512, 2048, 2048, 512, 512]
    - [7, 1958.35]
  - - [2048, 256, 1, 768, 2048, 2048, 768, 768]
    - [12, 5580.01]
  - - [256, 4608, 1, 1024, 256, 256, 1024, 1024]
    - [12, 10581.3]
  - - [256, 2304, 1, 1024, 256, 256, 1024, 1024]
    - [29, 6419.85]
  - - [256, 2560, 1, 1024, 256, 256, 1024, 1024]
    - [9, 7013.89]
  - - [2048, 512, 1, 74, 2048, 2048, 74, 74]
    - [23, 2827.79]
  - - [2816, 8976, 1, 256, 2816, 2816, 256, 256]
    - [31, 16851.0]
- null
