dev-mfma-nt/3_LibraryLogic/arcturus_Cijk_Ailk_Bjlk_BBH.yaml
- {MinimumRequiredVersion: 4.15.0}
- arcturus
- gfx908
- [Device 7380, Device 7388, Device 738c, Device 7390]
    SolutionIndex: 0
    SolutionNameMin: Cijk_Ailk_Bjlk_BBH_MT64x128x8_MI32x32x2x2_SE_AF0EM1_AF1EM1_ASEM2_ONLL0_SNLL1_USFGRO0
    SolutionIndex: 1
    SolutionNameMin: Cijk_Ailk_Bjlk_BBH_MT64x128x8_MI32x32x2x2_SE_AF0EM2_AF1EM1_ASEM1_ONLL0_SNLL1_USFGRO0
    SolutionIndex: 2
    SolutionNameMin: Cijk_Ailk_Bjlk_BBH_MT64x128x8_MI32x32x2x2_SE_AF0EM1_AF1EM2_ASEM1_ONLL0_SNLL1_USFGRO0
    SolutionIndex: 3
    SolutionNameMin: Cijk_Ailk_Bjlk_BBH_MT64x128x16_MI32x32x2x2_SE_AF0EM1_AF1EM1_ASEM1_ONLL0_SNLL1_USFGRO0
    SolutionIndex: 4
    SolutionNameMin: Cijk_Ailk_Bjlk_BBH_MT64x128x16_MI32x32x2x2_SE_AF0EM1_AF1EM1_ASEM2_ONLL0_SNLL1_USFGRO0
    SolutionIndex: 5
    SolutionNameMin: Cijk_Ailk_Bjlk_BBH_MT64x128x16_MI32x32x2x2_SE_AF0EM2_AF1EM1_ASEM1_ONLL0_SNLL1_USFGRO0
    SolutionIndex: 6
    SolutionNameMin: Cijk_Ailk_Bjlk_BBH_MT64x128x16_MI32x32x2x2_SE_AF0EM2_AF1EM1_ASEM2_ONLL0_SNLL1_USFGRO0
    SolutionIndex: 7
    SolutionNameMin: Cijk_Ailk_Bjlk_BBH_MT64x128x16_MI32x32x2x2_SE_AF0EM1_AF1EM2_ASEM2_ONLL0_SNLL1_USFGRO0
    SolutionIndex: 8
    SolutionNameMin: Cijk_Ailk_Bjlk_BBH_MT64x128x16_MI32x32x2x2_SE_AF0EM2_AF1EM2_ASEM2_ONLL0_SNLL1_USFGRO1
    SolutionIndex: 9
    SolutionNameMin: Cijk_Ailk_Bjlk_BBH_MT64x128x8_MI32x32x2x2_SE_AF0EM1_AF1EM1_ASEM1_ONLL0_SNLL0_USFGRO0
    SolutionIndex: 10
    SolutionNameMin: Cijk_Ailk_Bjlk_BBH_MT64x128x8_MI32x32x2x2_SE_AF0EM2_AF1EM1_ASEM1_ONLL0_SNLL0_USFGRO0
    SolutionIndex: 11
    SolutionNameMin: Cijk_Ailk_Bjlk_BBH_MT64x128x8_MI32x32x2x2_SE_AF0EM2_AF1EM1_ASEM2_ONLL0_SNLL0_USFGRO0
    SolutionIndex: 12
    SolutionNameMin: Cijk_Ailk_Bjlk_BBH_MT64x128x8_MI32x32x2x2_SE_AF0EM1_AF1EM2_ASEM1_ONLL0_SNLL0_USFGRO0
    SolutionIndex: 13
    SolutionNameMin: Cijk_Ailk_Bjlk_BBH_MT64x128x8_MI32x32x2x2_SE_AF0EM1_AF1EM2_ASEM2_ONLL0_SNLL0_USFGRO0
    SolutionIndex: 14
    SolutionNameMin: Cijk_Ailk_Bjlk_BBH_MT64x128x8_MI32x32x2x2_SE_AF0EM2_AF1EM2_ASEM2_ONLL0_SNLL0_USFGRO1
    SolutionIndex: 15
    SolutionNameMin: Cijk_Ailk_Bjlk_BBH_MT32x256x16_MI32x32x2x2_SE_AF0EM2_AF1EM1_ASEM2_ONLL0_SNLL0_USFGRO0
    SolutionIndex: 16
    SolutionNameMin: Cijk_Ailk_Bjlk_BBH_MT64x128x16_MI32x32x2x2_SE_AF0EM1_AF1EM1_ASEM1_ONLL0_SNLL0_USFGRO0
    SolutionIndex: 17
    SolutionNameMin: Cijk_Ailk_Bjlk_BBH_MT64x128x16_MI32x32x2x2_SE_AF0EM1_AF1EM1_ASEM2_ONLL0_SNLL0_USFGRO0
    SolutionIndex: 18
    SolutionNameMin: Cijk_Ailk_Bjlk_BBH_MT64x128x16_MI32x32x2x2_SE_AF0EM2_AF1EM1_ASEM1_ONLL0_SNLL0_USFGRO0
    SolutionIndex: 19
    SolutionNameMin: Cijk_Ailk_Bjlk_BBH_MT64x128x16_MI32x32x2x2_SE_AF0EM2_AF1EM1_ASEM2_ONLL0_SNLL0_USFGRO0
    SolutionIndex: 20
    SolutionNameMin: Cijk_Ailk_Bjlk_BBH_MT64x128x16_MI32x32x2x2_SE_AF0EM1_AF1EM2_ASEM1_ONLL0_SNLL0_USFGRO0
    SolutionIndex: 21
    SolutionNameMin: Cijk_Ailk_Bjlk_BBH_MT64x128x16_MI32x32x2x2_SE_AF0EM2_AF1EM2_ASEM1_ONLL0_SNLL0_USFGRO1
    SolutionIndex: 22
    SolutionNameMin: Cijk_Ailk_Bjlk_BBH_MT64x128x32_MI32x32x2x2_SE_AF0EM1_AF1EM1_ASEM1_ONLL0_SNLL0_USFGRO0
    SolutionIndex: 23
    SolutionNameMin: Cijk_Ailk_Bjlk_BBH_MT64x128x32_MI32x32x2x2_SE_AF0EM1_AF1EM1_ASEM2_ONLL0_SNLL0_USFGRO0
    SolutionIndex: 24
    SolutionNameMin: Cijk_Ailk_Bjlk_BBH_MT64x128x32_MI32x32x2x2_SE_AF0EM2_AF1EM1_ASEM1_ONLL0_SNLL0_USFGRO0
    SolutionIndex: 25
    SolutionNameMin: Cijk_Ailk_Bjlk_BBH_MT64x128x32_MI32x32x2x2_SE_AF0EM2_AF1EM1_ASEM2_ONLL0_SNLL0_USFGRO0
    SolutionIndex: 26
    SolutionNameMin: Cijk_Ailk_Bjlk_BBH_MT64x128x8_MI32x32x2x2_SE_AF0EM1_AF1EM1_ASEM1_ONLL1_SNLL1_USFGRO0
    SolutionIndex: 27
    SolutionNameMin: Cijk_Ailk_Bjlk_BBH_MT64x128x8_MI32x32x2x2_SE_AF0EM1_AF1EM2_ASEM1_ONLL1_SNLL1_USFGRO0
    SolutionIndex: 28
    SolutionNameMin: Cijk_Ailk_Bjlk_BBH_MT64x128x8_MI32x32x2x2_SE_AF0EM2_AF1EM2_ASEM1_ONLL1_SNLL1_USFGRO1
    SolutionIndex: 29
    SolutionNameMin: Cijk_Ailk_Bjlk_BBH_MT64x128x16_MI32x32x2x2_SE_AF0EM2_AF1EM1_ASEM2_ONLL1_SNLL1_USFGRO0
    SolutionIndex: 30
    SolutionNameMin: Cijk_Ailk_Bjlk_BBH_MT64x128x16_MI32x32x2x2_SE_AF0EM2_AF1EM2_ASEM1_ONLL1_SNLL1_USFGRO1
    SolutionIndex: 31
    SolutionNameMin: Cijk_Ailk_Bjlk_BBH_MT64x128x32_MI32x32x2x2_SE_AF0EM2_AF1EM1_ASEM1_ONLL1_SNLL1_USFGRO0
    SolutionIndex: 32
    SolutionNameMin: Cijk_Ailk_Bjlk_BBH_MT64x128x8_MI32x32x2x2_SE_AF0EM1_AF1EM1_ASEM1_ONLL1_SNLL0_USFGRO0
    SolutionIndex: 33
    SolutionNameMin: Cijk_Ailk_Bjlk_BBH_MT64x128x8_MI32x32x2x2_SE_AF0EM2_AF1EM1_ASEM1_ONLL1_SNLL0_USFGRO0
    SolutionIndex: 34
    SolutionNameMin: Cijk_Ailk_Bjlk_BBH_MT64x128x8_MI32x32x2x2_SE_AF0EM1_AF1EM2_ASEM2_ONLL1_SNLL0_USFGRO0
    SolutionIndex: 35
    SolutionNameMin: Cijk_Ailk_Bjlk_BBH_MT64x128x8_MI32x32x2x2_SE_AF0EM2_AF1EM2_ASEM2_ONLL1_SNLL0_USFGRO1
    SolutionIndex: 36
    SolutionNameMin: Cijk_Ailk_Bjlk_BBH_MT32x256x16_MI32x32x2x2_SE_AF0EM2_AF1EM1_ASEM1_ONLL1_SNLL0_USFGRO0
    SolutionIndex: 37
    SolutionNameMin: Cijk_Ailk_Bjlk_BBH_MT64x128x16_MI32x32x2x2_SE_AF0EM1_AF1EM1_ASEM1_ONLL1_SNLL0_USFGRO0
    SolutionIndex: 38
    SolutionNameMin: Cijk_Ailk_Bjlk_BBH_MT64x128x16_MI32x32x2x2_SE_AF0EM1_AF1EM1_ASEM2_ONLL1_SNLL0_USFGRO0
    SolutionIndex: 39
    SolutionNameMin: Cijk_Ailk_Bjlk_BBH_MT64x128x16_MI32x32x2x2_SE_AF0EM2_AF1EM1_ASEM2_ONLL1_SNLL0_USFGRO0
    SolutionIndex: 40
    SolutionNameMin: Cijk_Ailk_Bjlk_BBH_MT64x128x16_MI32x32x2x2_SE_AF0EM1_AF1EM2_ASEM1_ONLL1_SNLL0_USFGRO0
    SolutionIndex: 41
    SolutionNameMin: Cijk_Ailk_Bjlk_BBH_MT64x128x16_MI32x32x2x2_SE_AF0EM1_AF1EM2_ASEM2_ONLL1_SNLL0_USFGRO0
    SolutionIndex: 42
    SolutionNameMin: Cijk_Ailk_Bjlk_BBH_MT64x128x16_MI32x32x2x2_SE_AF0EM2_AF1EM2_ASEM1_ONLL1_SNLL0_USFGRO1
    SolutionIndex: 43
    SolutionNameMin: Cijk_Ailk_Bjlk_BBH_MT64x128x16_MI32x32x2x2_SE_AF0EM2_AF1EM2_ASEM2_ONLL1_SNLL0_USFGRO1
    SolutionIndex: 44
    SolutionNameMin: Cijk_Ailk_Bjlk_BBH_MT64x128x32_MI32x32x2x2_SE_AF0EM1_AF1EM1_ASEM1_ONLL1_SNLL0_USFGRO0
    SolutionIndex: 45
    SolutionNameMin: Cijk_Ailk_Bjlk_BBH_MT64x128x32_MI32x32x2x2_SE_AF0EM1_AF1EM1_ASEM2_ONLL1_SNLL0_USFGRO0
    SolutionIndex: 46
    SolutionNameMin: Cijk_Ailk_Bjlk_BBH_MT64x128x32_MI32x32x2x2_SE_AF0EM2_AF1EM1_ASEM1_ONLL1_SNLL0_USFGRO0
    SolutionIndex: 47
    SolutionNameMin: Cijk_Ailk_Bjlk_BBH_MT64x128x32_MI32x32x2x2_SE_AF0EM2_AF1EM1_ASEM2_ONLL1_SNLL0_USFGRO0
    SolutionIndex: 48
    SolutionNameMin: Cijk_Ailk_Bjlk_BBH_MT64x128x32_MI32x32x2x2_SE_AF0EM1_AF1EM2_ASEM1_ONLL1_SNLL0_USFGRO0
    SolutionIndex: 49
    SolutionNameMin: Cijk_Ailk_Bjlk_BBH_MT64x128x32_MI32x32x2x2_SE_AF0EM2_AF1EM2_ASEM2_ONLL1_SNLL0_USFGRO1
    SolutionIndex: 50
    SolutionNameMin: Cijk_Ailk_Bjlk_BBH_MT64x256x8_MI32x32x2x2_SE_AF0EM1_AF1EM1_ASEM2_ONLL0_SNLL0_USFGRO0
    SolutionIndex: 51
    SolutionNameMin: Cijk_Ailk_Bjlk_BBH_MT64x256x8_MI32x32x2x2_SE_AF0EM2_AF1EM1_ASEM2_ONLL1_SNLL1_USFGRO0
    SolutionIndex: 52
    SolutionNameMin: Cijk_Ailk_Bjlk_BBH_MT64x256x8_MI32x32x2x2_SE_AF0EM1_AF1EM1_ASEM1_ONLL1_SNLL0_USFGRO0
    SolutionIndex: 53
    SolutionNameMin: Cijk_Ailk_Bjlk_BBH_MT64x256x8_MI32x32x2x2_SE_AF0EM1_AF1EM2_ASEM1_ONLL1_SNLL0_USFGRO0
- - - [1024, 256, 1, 18944, 1024, 1024, 1024, 256]
    - [44, 3882.65]
  - - [33, 32, 1600, 33, 33, 33, 33, 32]
    - [27, 726.0]
  - - [1024, 256, 1, 15872, 1024, 1024, 1024, 256]
    - [23, 3878.41]
  - - [256, 11520, 1, 8976, 256, 256, 256, 11520]
    - [17, 32313.6]
  - - [512, 32, 1, 1600, 512, 512, 512, 32]
    - [33, 223.672]
  - - [1024, 256, 1, 4352, 1024, 1024, 1024, 256]
    - [44, 3747.87]
  - - [256, 9728, 1, 8976, 256, 256, 256, 9728]
    - [9, 27863.9]
  - - [1024, 256, 1, 3072, 1024, 1024, 1024, 256]
    - [44, 3694.07]
  - - [74, 2048, 1, 512, 74, 74, 74, 2048]
    - [19, 1776.43]
  - - [1024, 1024, 1, 512, 1024, 1024, 1024, 1024]
    - [44, 10198.9]
  - - [2048, 256, 1, 1024, 2048, 2048, 2048, 256]
    - [10, 6521.76]
  - - [1024, 256, 1, 2816, 1024, 1024, 1024, 256]
    - [18, 3677.75]
  - - [33, 32, 200, 33, 33, 33, 33, 32]
    - [2, 378.783]
  - - [100, 2048, 1, 512, 100, 100, 100, 2048]
    - [18, 2365.92]
  - - [2048, 2048, 1, 512, 2048, 2048, 2048, 2048]
    - [21, 12614.4]
  - - [1024, 256, 1, 15104, 1024, 1024, 1024, 256]
    - [45, 3874.5]
  - - [1024, 256, 1, 19968, 1024, 1024, 1024, 256]
    - [44, 3887.77]
  - - [256, 12800, 1, 8976, 256, 256, 256, 12800]
    - [35, 28967.7]
  - - [1024, 256, 1, 3328, 1024, 1024, 1024, 256]
    - [23, 3715.57]
  - - [256, 2816, 1, 8976, 256, 256, 256, 2816]
    - [23, 10530.5]
  - - [1024, 64, 1, 512, 1024, 1024, 1024, 64]
    - [15, 709.696]
  - - [256, 21248, 1, 8976, 256, 256, 256, 21248]
    - [38, 29726.3]
  - - [1024, 1024, 1, 200, 1024, 1024, 1024, 1024]
    - [43, 6704.45]
  - - [256, 10496, 1, 8976, 256, 256, 256, 10496]
    - [41, 29899.7]
  - - [2048, 2048, 1, 1024, 2048, 2048, 2048, 2048]
    - [30, 14470.9]
  - - [1024, 256, 1, 4608, 1024, 1024, 1024, 256]
    - [24, 3758.9]
  - - [256, 15872, 1, 8976, 256, 256, 256, 15872]
    - [12, 21768.4]
  - - [1600, 1024, 1, 512, 1600, 1600, 1600, 1024]
    - [21, 15984.4]
  - - [1024, 256, 1, 6400, 1024, 1024, 1024, 256]
    - [23, 3808.16]
  - - [1024, 256, 1, 13568, 1024, 1024, 1024, 256]
    - [44, 3866.4]
  - - [256, 44505, 1, 8976, 256, 256, 256, 44505]
    - [32, 32808.8]
  - - [256, 6144, 1, 8976, 256, 256, 256, 6144]
    - [49, 19826.5]
  - - [1024, 256, 1, 5120, 1024, 1024, 1024, 256]
    - [44, 3779.51]
  - - [256, 33536, 1, 8976, 256, 256, 256, 33536]
    - [41, 30754.5]
  - - [256, 3840, 1, 8976, 256, 256, 256, 3840]
    - [23, 14313.2]
  - - [1024, 256, 1, 21248, 1024, 1024, 1024, 256]
    - [22, 3889.91]
  - - [1024, 256, 1, 12032, 1024, 1024, 1024, 256]
    - [22, 3864.21]
  - - [256, 8192, 1, 8976, 256, 256, 256, 8192]
    - [0, 20537.7]
  - - [256, 13568, 1, 8976, 256, 256, 256, 13568]
    - [32, 30578.0]
  - - [1024, 256, 1, 16128, 1024, 1024, 1024, 256]
    - [44, 3878.77]
  - - [1024, 256, 1, 14336, 1024, 1024, 1024, 256]
    - [23, 3871.14]
  - - [256, 11264, 1, 8976, 256, 256, 256, 11264]
    - [14, 21224.0]
  - - [1024, 256, 1, 5376, 1024, 1024, 1024, 256]
    - [23, 3780.28]
  - - [256, 10240, 1, 8976, 256, 256, 256, 10240]
    - [26, 20024.9]
  - - [256, 4096, 1, 8976, 256, 256, 256, 4096]
    - [6, 14019.4]
  - - [1024, 256, 1, 4096, 1024, 1024, 1024, 256]
    - [22, 3743.88]
  - - [256, 2560, 1, 8976, 256, 256, 256, 2560]
    - [23, 9574.42]
  - - [256, 20992, 1, 8976, 256, 256, 256, 20992]
    - [16, 29545.2]
  - - [256, 4352, 1, 8976, 256, 256, 256, 4352]
    - [39, 14904.4]
  - - [256, 8960, 1, 8976, 256, 256, 256, 8960]
    - [40, 25790.2]
  - - [256, 3584, 1, 8976, 256, 256, 256, 3584]
    - [23, 13355.5]
  - - [9, 64, 512, 9, 9, 9, 9, 64]
    - [12, 97.5812]
  - - [256, 26112, 1, 8976, 256, 256, 256, 26112]
    - [2, 32611.0]
  - - [512, 32, 1, 200, 512, 512, 512, 32]
    - [10, 132.987]
  - - [256, 14336, 1, 8976, 256, 256, 256, 14336]
    - [52, 22374.3]
  - - [1024, 256, 1, 14848, 1024, 1024, 1024, 256]
    - [44, 3873.73]
  - - [512, 512, 1, 1600, 512, 512, 512, 512]
    - [33, 3516.35]
  - - [1024, 256, 1, 8448, 1024, 1024, 1024, 256]
    - [45, 3831.48]
  - - [560, 1024, 1, 1600, 560, 560, 560, 1024]
    - [47, 7855.34]
  - - [256, 22016, 1, 8976, 256, 256, 256, 22016]
    - [7, 30730.4]
  - - [4096, 4096, 1, 1024, 4096, 4096, 4096, 4096]
    - [51, 9244.85]
  - - [256, 5120, 1, 8976, 256, 256, 256, 5120]
    - [19, 17369.0]
  - - [256, 3328, 1, 8976, 256, 256, 256, 3328]
    - [45, 12412.8]
  - - [256, 19968, 1, 8976, 256, 256, 256, 19968]
    - [29, 28130.2]
  - - [1024, 256, 1, 22016, 1024, 1024, 1024, 256]
    - [23, 3887.81]
  - - [1024, 256, 1, 5632, 1024, 1024, 1024, 256]
    - [45, 3788.74]
  - - [1024, 256, 1, 33536, 1024, 1024, 1024, 256]
    - [44, 3903.35]
  - - [1024, 256, 1, 7936, 1024, 1024, 1024, 256]
    - [22, 3830.42]
  - - [256, 17408, 1, 8976, 256, 256, 256, 17408]
    - [39, 17289.0]
  - - [256, 5632, 1, 8976, 256, 256, 256, 5632]
    - [16, 19112.6]
  - - [257, 4096, 1, 1024, 257, 257, 257, 4096]
    - [3, 11209.8]
  - - [256, 11008, 1, 8976, 256, 256, 256, 11008]
    - [20, 31166.6]
  - - [1024, 256, 1, 6144, 1024, 1024, 1024, 256]
    - [23, 3802.21]
  - - [256, 4864, 1, 8976, 256, 256, 256, 4864]
    - [17, 16602.5]
  - - [256, 15104, 1, 8976, 256, 256, 256, 15104]
    - [42, 33129.9]
  - - [1024, 256, 1, 9984, 1024, 1024, 1024, 256]
    - [44, 3850.26]
  - - [3200, 2048, 1, 1024, 3200, 3200, 3200, 2048]
    - [53, 17814.0]
  - - [1024, 256, 1, 1024, 1024, 1024, 1024, 256]
    - [37, 3318.93]
  - - [1024, 256, 1, 9728, 1024, 1024, 1024, 256]
    - [44, 3849.39]
  - - [1024, 256, 1, 10496, 1024, 1024, 1024, 256]
    - [45, 3851.01]
  - - [256, 11776, 1, 8976, 256, 256, 256, 11776]
    - [13, 27079.1]
  - - [256, 12544, 1, 8976, 256, 256, 256, 12544]
    - [34, 28652.4]
  - - [1024, 256, 1, 17152, 1024, 1024, 1024, 256]
    - [23, 3882.01]
  - - [1024, 256, 1, 11520, 1024, 1024, 1024, 256]
    - [25, 3847.99]
  - - [1024, 256, 1, 21504, 1024, 1024, 1024, 256]
    - [23, 3890.91]
  - - [256, 17152, 1, 8976, 256, 256, 256, 17152]
    - [38, 23105.8]
  - - [1024, 256, 1, 17408, 1024, 1024, 1024, 256]
    - [25, 3870.97]
  - - [256, 1280, 1, 8976, 256, 256, 256, 1280]
    - [23, 4804.1]
  - - [256, 18688, 1, 8976, 256, 256, 256, 18688]
    - [4, 27504.6]
  - - [67, 2048, 1, 512, 67, 67, 67, 2048]
    - [20, 1498.6]
  - - [256, 5888, 1, 8976, 256, 256, 256, 5888]
    - [38, 19983.7]
  - - [512, 2048, 1, 256, 512, 512, 512, 2048]
    - [8, 7803.36]
  - - [768, 2048, 1, 256, 768, 768, 768, 2048]
    - [42, 10917.9]
  - - [1024, 256, 1, 7680, 1024, 1024, 1024, 256]
    - [44, 3825.18]
  - - [1024, 256, 1, 1280, 1024, 1024, 1024, 256]
    - [25, 3401.71]
  - - [256, 14848, 1, 8976, 256, 256, 256, 14848]
    - [1, 32849.3]
  - - [256, 7168, 1, 8976, 256, 256, 256, 7168]
    - [36, 21379.9]
  - - [256, 9984, 1, 8976, 256, 256, 256, 9984]
    - [20, 28577.3]
  - - [1024, 256, 1, 3584, 1024, 1024, 1024, 256]
    - [48, 3712.95]
  - - [256, 20480, 1, 8976, 256, 256, 256, 20480]
    - [11, 17646.2]
  - - [1024, 256, 1, 8192, 1024, 1024, 1024, 256]
    - [23, 3829.33]
  - - [1024, 256, 1, 19712, 1024, 1024, 1024, 256]
    - [45, 3886.19]
  - - [1024, 256, 1, 28672, 1024, 1024, 1024, 256]
    - [31, 3883.94]
  - - [560, 1024, 1, 200, 560, 560, 560, 1024]
    - [15, 4843.24]
  - - [5, 64, 512, 5, 5, 5, 5, 64]
    - [12, 31.6049]
  - - [256, 13312, 1, 8976, 256, 256, 256, 13312]
    - [50, 22677.4]
  - - [256, 32512, 1, 8976, 256, 256, 256, 32512]
    - [5, 30137.8]
  - - [1024, 1024, 1, 1600, 1024, 1024, 1024, 1024]
    - [38, 12694.6]
  - - [1024, 256, 1, 2304, 1024, 1024, 1024, 256]
    - [46, 3617.51]
  - - [512, 512, 1, 200, 512, 512, 512, 512]
    - [11, 2080.51]
  - - [256, 16128, 1, 8976, 256, 256, 256, 16128]
    - [28, 21123.0]
- null
