dev-mfma-nn/3_LibraryLogic/arcturus_Cijk_Ailk_Bljk_BBH.yaml
- {MinimumRequiredVersion: 4.15.0}
- arcturus
- gfx908
- [Device 7380, Device 7388, Device 738c, Device 7390]
    SolutionIndex: 0
    SolutionNameMin: Cijk_Ailk_Bljk_BBH_MT64x128x8_MI32x32x2x2_SE_AF0EM1_AF1EM1_ASEM1_GRVW2_ONLL0_SNLL1_USFGRO0
    SolutionIndex: 1
    SolutionNameMin: Cijk_Ailk_Bljk_BBH_MT64x128x16_MI32x32x2x2_SE_AF0EM1_AF1EM1_ASEM2_GRVW2_ONLL0_SNLL1_USFGRO0
    SolutionIndex: 2
    SolutionNameMin: Cijk_Ailk_Bljk_BBH_MT64x128x16_MI32x32x2x2_SE_AF0EM2_AF1EM1_ASEM1_GRVW2_ONLL0_SNLL1_USFGRO1
    SolutionIndex: 3
    SolutionNameMin: Cijk_Ailk_Bljk_BBH_MT64x128x16_MI32x32x2x2_SE_AF0EM1_AF1EM2_ASEM2_GRVW2_ONLL0_SNLL1_USFGRO0
    SolutionIndex: 4
    SolutionNameMin: Cijk_Ailk_Bljk_BBH_MT64x128x16_MI32x32x2x2_SE_AF0EM2_AF1EM2_ASEM1_GRVW2_ONLL0_SNLL1_USFGRO1
    SolutionIndex: 5
    SolutionNameMin: Cijk_Ailk_Bljk_BBH_MT64x128x8_MI32x32x2x2_SE_AF0EM2_AF1EM1_ASEM2_GRVW4_ONLL0_SNLL1_USFGRO1
    SolutionIndex: 6
    SolutionNameMin: Cijk_Ailk_Bljk_BBH_MT64x128x16_MI32x32x2x2_SE_AF0EM1_AF1EM1_ASEM2_GRVW2_ONLL0_SNLL0_USFGRO0
    SolutionIndex: 7
    SolutionNameMin: Cijk_Ailk_Bljk_BBH_MT64x128x16_MI32x32x2x2_SE_AF0EM2_AF1EM1_ASEM1_GRVW2_ONLL0_SNLL0_USFGRO1
    SolutionIndex: 8
    SolutionNameMin: Cijk_Ailk_Bljk_BBH_MT64x128x16_MI32x32x2x2_SE_AF0EM2_AF1EM1_ASEM2_GRVW2_ONLL0_SNLL0_USFGRO1
    SolutionIndex: 9
    SolutionNameMin: Cijk_Ailk_Bljk_BBH_MT64x128x16_MI32x32x2x2_SE_AF0EM1_AF1EM2_ASEM1_GRVW2_ONLL0_SNLL0_USFGRO0
    SolutionIndex: 10
    SolutionNameMin: Cijk_Ailk_Bljk_BBH_MT64x128x16_MI32x32x2x2_SE_AF0EM1_AF1EM2_ASEM2_GRVW2_ONLL0_SNLL0_USFGRO0
    SolutionIndex: 11
    SolutionNameMin: Cijk_Ailk_Bljk_BBH_MT64x128x16_MI32x32x2x2_SE_AF0EM2_AF1EM2_ASEM1_GRVW2_ONLL0_SNLL0_USFGRO1
    SolutionIndex: 12
    SolutionNameMin: Cijk_Ailk_Bljk_BBH_MT64x128x16_MI32x32x2x2_SE_AF0EM2_AF1EM2_ASEM2_GRVW2_ONLL0_SNLL0_USFGRO1
    SolutionIndex: 13
    SolutionNameMin: Cijk_Ailk_Bljk_BBH_MT64x128x8_MI32x32x2x2_SE_AF0EM2_AF1EM1_ASEM1_GRVW4_ONLL0_SNLL0_USFGRO1
    SolutionIndex: 14
    SolutionNameMin: Cijk_Ailk_Bljk_BBH_MT64x128x8_MI32x32x2x2_SE_AF0EM2_AF1EM1_ASEM2_GRVW4_ONLL0_SNLL0_USFGRO1
    SolutionIndex: 15
    SolutionNameMin: Cijk_Ailk_Bljk_BBH_MT64x128x8_MI32x32x2x2_SE_AF0EM1_AF1EM2_ASEM1_GRVW4_ONLL0_SNLL0_USFGRO0
    SolutionIndex: 16
    SolutionNameMin: Cijk_Ailk_Bljk_BBH_MT32x256x16_MI32x32x2x2_SE_AF0EM2_AF1EM1_ASEM2_GRVW4_ONLL0_SNLL0_USFGRO1
    SolutionIndex: 17
    SolutionNameMin: Cijk_Ailk_Bljk_BBH_MT64x128x8_MI32x32x2x2_SE_AF0EM1_AF1EM2_ASEM2_GRVW2_ONLL1_SNLL1_USFGRO0
    SolutionIndex: 18
    SolutionNameMin: Cijk_Ailk_Bljk_BBH_MT64x128x16_MI32x32x2x2_SE_AF0EM1_AF1EM1_ASEM2_GRVW2_ONLL1_SNLL1_USFGRO0
    SolutionIndex: 19
    SolutionNameMin: Cijk_Ailk_Bljk_BBH_MT64x128x16_MI32x32x2x2_SE_AF0EM2_AF1EM1_ASEM2_GRVW2_ONLL1_SNLL1_USFGRO1
    SolutionIndex: 20
    SolutionNameMin: Cijk_Ailk_Bljk_BBH_MT64x128x16_MI32x32x2x2_SE_AF0EM1_AF1EM2_ASEM2_GRVW2_ONLL1_SNLL1_USFGRO0
    SolutionIndex: 21
    SolutionNameMin: Cijk_Ailk_Bljk_BBH_MT64x128x16_MI32x32x2x2_SE_AF0EM2_AF1EM2_ASEM2_GRVW2_ONLL1_SNLL1_USFGRO1
    SolutionIndex: 22
    SolutionNameMin: Cijk_Ailk_Bljk_BBH_MT64x128x8_MI32x32x2x2_SE_AF0EM1_AF1EM1_ASEM1_GRVW4_ONLL1_SNLL1_USFGRO0
    SolutionIndex: 23
    SolutionNameMin: Cijk_Ailk_Bljk_BBH_MT64x128x8_MI32x32x2x2_SE_AF0EM2_AF1EM1_ASEM1_GRVW4_ONLL1_SNLL1_USFGRO1
    SolutionIndex: 24
    SolutionNameMin: Cijk_Ailk_Bljk_BBH_MT64x128x8_MI32x32x2x2_SE_AF0EM1_AF1EM1_ASEM1_GRVW2_ONLL1_SNLL0_USFGRO0
    SolutionIndex: 25
    SolutionNameMin: Cijk_Ailk_Bljk_BBH_MT64x128x8_MI32x32x2x2_SE_AF0EM1_AF1EM2_ASEM1_GRVW2_ONLL1_SNLL0_USFGRO0
    SolutionIndex: 26
    SolutionNameMin: Cijk_Ailk_Bljk_BBH_MT64x128x16_MI32x32x2x2_SE_AF0EM1_AF1EM1_ASEM1_GRVW2_ONLL1_SNLL0_USFGRO0
    SolutionIndex: 27
    SolutionNameMin: Cijk_Ailk_Bljk_BBH_MT64x128x16_MI32x32x2x2_SE_AF0EM2_AF1EM1_ASEM1_GRVW2_ONLL1_SNLL0_USFGRO1
    SolutionIndex: 28
    SolutionNameMin: Cijk_Ailk_Bljk_BBH_MT64x128x16_MI32x32x2x2_SE_AF0EM2_AF1EM1_ASEM2_GRVW2_ONLL1_SNLL0_USFGRO1
    SolutionIndex: 29
    SolutionNameMin: Cijk_Ailk_Bljk_BBH_MT64x128x16_MI32x32x2x2_SE_AF0EM1_AF1EM2_ASEM2_GRVW2_ONLL1_SNLL0_USFGRO0
    SolutionIndex: 30
    SolutionNameMin: Cijk_Ailk_Bljk_BBH_MT64x128x16_MI32x32x2x2_SE_AF0EM2_AF1EM2_ASEM1_GRVW2_ONLL1_SNLL0_USFGRO1
    SolutionIndex: 31
    SolutionNameMin: Cijk_Ailk_Bljk_BBH_MT64x128x16_MI32x32x2x2_SE_AF0EM2_AF1EM2_ASEM2_GRVW2_ONLL1_SNLL0_USFGRO1
    SolutionIndex: 32
    SolutionNameMin: Cijk_Ailk_Bljk_BBH_MT64x128x32_MI32x32x2x2_SE_AF0EM1_AF1EM1_ASEM1_GRVW2_ONLL1_SNLL0_USFGRO0
    SolutionIndex: 33
    SolutionNameMin: Cijk_Ailk_Bljk_BBH_MT64x128x8_MI32x32x2x2_SE_AF0EM1_AF1EM1_ASEM1_GRVW4_ONLL1_SNLL0_USFGRO0
    SolutionIndex: 34
    SolutionNameMin: Cijk_Ailk_Bljk_BBH_MT64x128x8_MI32x32x2x2_SE_AF0EM2_AF1EM1_ASEM1_GRVW4_ONLL1_SNLL0_USFGRO1
    SolutionIndex: 35
    SolutionNameMin: Cijk_Ailk_Bljk_BBH_MT64x128x8_MI32x32x2x2_SE_AF0EM2_AF1EM2_ASEM2_GRVW4_ONLL1_SNLL0_USFGRO1
    SolutionIndex: 36
    SolutionNameMin: Cijk_Ailk_Bljk_BBH_MT32x256x16_MI32x32x2x2_SE_AF0EM2_AF1EM1_ASEM2_GRVW4_ONLL1_SNLL0_USFGRO1
    SolutionIndex: 37
    SolutionNameMin: Cijk_Ailk_Bljk_BBH_MT64x256x16_MI32x32x2x2_SE_AF0EM1_AF1EM2_ASEM1_GRVW2_ONLL0_SNLL0_USFGRO0
    SolutionIndex: 38
    SolutionNameMin: Cijk_Ailk_Bljk_BBH_MT64x256x16_MI32x32x2x2_SE_AF0EM2_AF1EM1_ASEM1_GRVW2_ONLL1_SNLL1_USFGRO1
    SolutionIndex: 39
    SolutionNameMin: Cijk_Ailk_Bljk_BBH_MT64x256x16_MI32x32x2x2_SE_AF0EM2_AF1EM1_ASEM2_GRVW2_ONLL1_SNLL1_USFGRO1
    SolutionIndex: 40
    SolutionNameMin: Cijk_Ailk_Bljk_BBH_MT64x256x16_MI32x32x2x2_SE_AF0EM2_AF1EM2_ASEM2_GRVW2_ONLL1_SNLL1_USFGRO1
    SolutionIndex: 41
    SolutionNameMin: Cijk_Ailk_Bljk_BBH_MT64x256x16_MI32x32x2x2_SE_AF0EM2_AF1EM2_ASEM2_GRVW2_ONLL1_SNLL0_USFGRO1
- - - [1024, 8192, 1, 256, 1024, 1024, 1024, 256]
    - [12, 13865.5]
  - - [1024, 22016, 1, 256, 1024, 1024, 1024, 256]
    - [31, 15092.5]
  - - [1024, 1600, 1, 1024, 1024, 1024, 1024, 1024]
    - [14, 13099.0]
  - - [1024, 1792, 1, 256, 1024, 1024, 1024, 256]
    - [31, 10265.8]
  - - [256, 8976, 1, 5632, 256, 256, 256, 5632]
    - [11, 16125.3]
  - - [256, 8976, 1, 4352, 256, 256, 256, 4352]
    - [15, 16285.0]
  - - [1024, 19968, 1, 256, 1024, 1024, 1024, 256]
    - [12, 15038.2]
  - - [74, 512, 1, 2048, 74, 74, 74, 2048]
    - [27, 416.817]
  - - [256, 8976, 1, 26112, 256, 256, 256, 26112]
    - [41, 9421.43]
  - - [257, 1024, 1, 4096, 257, 257, 257, 4096]
    - [18, 2900.8]
  - - [512, 256, 1, 2048, 512, 512, 512, 2048]
    - [26, 1426.63]
  - - [1024, 21504, 1, 256, 1024, 1024, 1024, 256]
    - [8, 15134.1]
  - - [512, 215, 1, 2048, 512, 512, 512, 2048]
    - [27, 1176.64]
  - - [100, 512, 1, 2048, 100, 100, 100, 2048]
    - [28, 562.058]
  - - [1024, 7168, 1, 256, 1024, 1024, 1024, 256]
    - [12, 13849.1]
  - - [256, 8976, 1, 15872, 256, 256, 256, 15872]
    - [20, 14920.0]
  - - [512, 1600, 1, 512, 512, 512, 512, 512]
    - [16, 7221.6]
  - - [1024, 3328, 1, 256, 1024, 1024, 1024, 256]
    - [28, 12063.3]
  - - [3200, 1024, 1, 2048, 3200, 3200, 3200, 2048]
    - [7, 17649.1]
  - - [256, 8976, 1, 1536, 256, 256, 256, 1536]
    - [7, 15062.8]
  - - [1024, 14848, 1, 256, 1024, 1024, 1024, 256]
    - [7, 14883.4]
  - - [1024, 28672, 1, 256, 1024, 1024, 1024, 256]
    - [30, 15257.0]
  - - [256, 8976, 1, 9728, 256, 256, 256, 9728]
    - [6, 16246.3]
  - - [1024, 8960, 1, 256, 1024, 1024, 1024, 256]
    - [7, 14047.9]
  - - [256, 8976, 1, 11520, 256, 256, 256, 11520]
    - [1, 15460.1]
  - - [1024, 19712, 1, 256, 1024, 1024, 1024, 256]
    - [27, 15088.2]
  - - [1024, 14336, 1, 256, 1024, 1024, 1024, 256]
    - [27, 14800.3]
  - - [256, 8976, 1, 7424, 256, 256, 256, 7424]
    - [13, 16457.6]
  - - [256, 8976, 1, 10240, 256, 256, 256, 10240]
    - [3, 13642.8]
  - - [1024, 18944, 1, 256, 1024, 1024, 1024, 256]
    - [7, 15037.7]
  - - [1024, 512, 1, 64, 1024, 1024, 1024, 64]
    - [14, 1941.81]
  - - [1024, 10496, 1, 256, 1024, 1024, 1024, 256]
    - [28, 14561.1]
  - - [256, 8976, 1, 5376, 256, 256, 256, 5376]
    - [33, 16458.8]
  - - [256, 8976, 1, 22016, 256, 256, 256, 22016]
    - [38, 9507.19]
  - - [256, 8976, 1, 33536, 256, 256, 256, 33536]
    - [37, 9127.34]
  - - [256, 8976, 1, 12288, 256, 256, 256, 12288]
    - [21, 10240.3]
  - - [1024, 9728, 1, 256, 1024, 1024, 1024, 256]
    - [28, 14161.1]
  - - [256, 8976, 1, 2048, 256, 256, 256, 2048]
    - [4, 10047.0]
  - - [1024, 3072, 1, 256, 1024, 1024, 1024, 256]
    - [30, 11247.3]
  - - [256, 8976, 1, 2304, 256, 256, 256, 2304]
    - [17, 15854.9]
  - - [1024, 7936, 1, 256, 1024, 1024, 1024, 256]
    - [30, 13607.9]
  - - [768, 256, 1, 2048, 768, 768, 768, 2048]
    - [29, 2140.86]
  - - [64, 5, 512, 5, 64, 64, 64, 5]
    - [34, 45.5111]
  - - [1024, 9984, 1, 256, 1024, 1024, 1024, 256]
    - [7, 14355.2]
  - - [1024, 5120, 1, 256, 1024, 1024, 1024, 256]
    - [30, 12605.0]
  - - [1024, 16128, 1, 256, 1024, 1024, 1024, 256]
    - [8, 14903.6]
  - - [256, 8976, 1, 14336, 256, 256, 256, 14336]
    - [9, 13829.1]
  - - [1024, 11264, 1, 256, 1024, 1024, 1024, 256]
    - [31, 14670.1]
  - - [256, 8976, 1, 8192, 256, 256, 256, 8192]
    - [29, 9261.99]
  - - [1024, 4608, 1, 256, 1024, 1024, 1024, 256]
    - [28, 12603.9]
  - - [256, 8976, 1, 9472, 256, 256, 256, 9472]
    - [11, 16200.2]
  - - [2048, 512, 1, 2048, 2048, 2048, 2048, 2048]
    - [27, 8882.71]
  - - [256, 8976, 1, 8448, 256, 256, 256, 8448]
    - [10, 16301.9]
  - - [256, 8976, 1, 20992, 256, 256, 256, 20992]
    - [40, 9405.5]
  - - [256, 8976, 1, 10496, 256, 256, 256, 10496]
    - [3, 15640.1]
  - - [1024, 15104, 1, 256, 1024, 1024, 1024, 256]
    - [27, 14885.0]
  - - [1024, 4096, 1, 256, 1024, 1024, 1024, 256]
    - [27, 11374.4]
  - - [1024, 12288, 1, 256, 1024, 1024, 1024, 256]
    - [31, 14668.6]
  - - [256, 8976, 1, 2560, 256, 256, 256, 2560]
    - [28, 15715.2]
  - - [1024, 14592, 1, 256, 1024, 1024, 1024, 256]
    - [27, 14785.1]
  - - [256, 8976, 1, 4864, 256, 256, 256, 4864]
    - [22, 16334.6]
  - - [256, 8976, 1, 2816, 256, 256, 256, 2816]
    - [0, 16235.4]
  - - [1024, 40448, 1, 256, 1024, 1024, 1024, 256]
    - [8, 15409.9]
  - - [1600, 512, 1, 1024, 1600, 1600, 1600, 1024]
    - [6, 8429.07]
  - - [256, 8976, 1, 6656, 256, 256, 256, 6656]
    - [30, 16234.9]
  - - [1024, 20992, 1, 256, 1024, 1024, 1024, 256]
    - [30, 15081.5]
  - - [256, 8976, 1, 20480, 256, 256, 256, 20480]
    - [2, 11755.9]
  - - [1024, 512, 1, 1024, 1024, 1024, 1024, 1024]
    - [10, 5326.1]
  - - [256, 8976, 1, 5888, 256, 256, 256, 5888]
    - [5, 16376.7]
  - - [1024, 7680, 1, 256, 1024, 1024, 1024, 256]
    - [27, 14446.5]
  - - [1024, 7424, 1, 256, 1024, 1024, 1024, 256]
    - [28, 14184.8]
  - - [256, 8976, 1, 14848, 256, 256, 256, 14848]
    - [8, 14652.2]
  - - [512, 200, 1, 32, 512, 512, 512, 32]
    - [35, 200.784]
  - - [768, 215, 1, 2048, 768, 768, 768, 2048]
    - [8, 1766.43]
  - - [1024, 2560, 1, 256, 1024, 1024, 1024, 256]
    - [28, 11475.5]
  - - [256, 8976, 1, 19968, 256, 256, 256, 19968]
    - [11, 12546.7]
  - - [256, 8976, 1, 9984, 256, 256, 256, 9984]
    - [14, 16374.9]
  - - [1024, 4864, 1, 256, 1024, 1024, 1024, 256]
    - [8, 12393.7]
  - - [560, 1600, 1, 1024, 560, 560, 560, 1024]
    - [12, 9073.42]
  - - [1024, 33536, 1, 256, 1024, 1024, 1024, 256]
    - [27, 15343.6]
  - - [256, 8976, 1, 15104, 256, 256, 256, 15104]
    - [2, 14689.9]
  - - [1024, 10240, 1, 256, 1024, 1024, 1024, 256]
    - [8, 14544.6]
  - - [1024, 13312, 1, 256, 1024, 1024, 1024, 256]
    - [8, 14781.7]
  - - [256, 8976, 1, 8960, 256, 256, 256, 8960]
    - [9, 16256.7]
  - - [1024, 6144, 1, 256, 1024, 1024, 1024, 256]
    - [12, 13395.0]
  - - [1024, 6400, 1, 256, 1024, 1024, 1024, 256]
    - [28, 13742.8]
  - - [64, 9, 512, 9, 64, 64, 64, 9]
    - [13, 130.62]
  - - [1024, 17152, 1, 256, 1024, 1024, 1024, 256]
    - [8, 14939.9]
  - - [256, 8976, 1, 19712, 256, 256, 256, 19712]
    - [39, 9546.33]
  - - [560, 200, 1, 1024, 560, 560, 560, 1024]
    - [27, 1165.53]
  - - [1024, 11520, 1, 256, 1024, 1024, 1024, 256]
    - [12, 14699.7]
  - - [1024, 5632, 1, 256, 1024, 1024, 1024, 256]
    - [7, 13599.8]
  - - [256, 8976, 1, 11008, 256, 256, 256, 11008]
    - [29, 16141.8]
  - - [256, 8976, 1, 17152, 256, 256, 256, 17152]
    - [26, 12596.8]
  - - [256, 8976, 1, 3072, 256, 256, 256, 3072]
    - [30, 15464.0]
  - - [1024, 3840, 1, 256, 1024, 1024, 1024, 256]
    - [8, 13617.9]
  - - [67, 512, 1, 2048, 67, 67, 67, 2048]
    - [26, 371.954]
  - - [1024, 20480, 1, 256, 1024, 1024, 1024, 256]
    - [12, 15114.6]
  - - [32, 33, 1600, 33, 32, 32, 32, 33]
    - [23, 1032.53]
  - - [1024, 23552, 1, 256, 1024, 1024, 1024, 256]
    - [11, 15210.0]
  - - [256, 8976, 1, 7168, 256, 256, 256, 7168]
    - [8, 16121.5]
  - - [1024, 13568, 1, 256, 1024, 1024, 1024, 256]
    - [28, 14615.3]
  - - [1024, 2048, 1, 256, 1024, 1024, 1024, 256]
    - [24, 10245.6]
  - - [512, 1600, 1, 32, 512, 512, 512, 32]
    - [36, 1715.6]
  - - [256, 8976, 1, 6144, 256, 256, 256, 6144]
    - [19, 12750.2]
  - - [1024, 8704, 1, 256, 1024, 1024, 1024, 256]
    - [30, 13865.5]
  - - [1024, 11008, 1, 256, 1024, 1024, 1024, 256]
    - [7, 14498.0]
  - - [1024, 8448, 1, 256, 1024, 1024, 1024, 256]
    - [31, 14167.0]
  - - [256, 8976, 1, 44505, 256, 256, 256, 44505]
    - [32, 8507.61]
  - - [2048, 1024, 1, 256, 2048, 2048, 2048, 256]
    - [25, 9218.25]
- null
